{
  "forbidden_signals": [
    "The explain skill activates implicitly before $explain",
    "Deliberation becomes active or conversation-wide",
    "A checkpoint, approval request, or file modification occurs"
  ],
  "human_evaluation": true,
  "id": "adapter-codex-explain-explicit-invocation",
  "required_signals": [
    "Codex accepts explicit $explain invocation",
    "The response satisfies the standalone Explain model",
    "The response remains a one-off explanation"
  ],
  "scenarios": [
    "A-06",
    "C-19"
  ]
}
