{
  "forbidden_signals": [
    "Codex continues the internal-only design after the public-API constraint without opening a Drift checkpoint",
    "Codex requests additional approval for approved routine completion, validation, or the local presentation correction"
  ],
  "human_evaluation": true,
  "id": "core-drift-and-routine-execution",
  "required_signals": [
    "Codex begins the approved milestone without a ceremonial checkpoint and produces Part 1",
    "Codex identifies the new public-API constraint as Drift, explains the invalidated assumptions and roadmap impact, and pauses before Part 2",
    "After revised approval Codex completes Part 2, examples, validation, and the walkthrough without repeated approval, then applies the local correction directly"
  ],
  "scenarios": [
    "C-08",
    "C-09"
  ]
}
