{
  "forbidden_signals": [
    "Codex przechodzi od inspekcji bezpośrednio do checkpointu bez widocznej roadmapy w głównej treści odpowiedzi",
    "Codex ukrywa roadmapę wyłącznie w commentary, progress surface albo detailed trace",
    "Codex przedstawia marker fazy Planning lub wpis [Plan] jako zamiennik roadmapy",
    "Codex traktuje roadmapę całego objective jako automatycznie zatwierdzony zakres"
  ],
  "human_evaluation": true,
  "id": "core-polish-roadmap-before-checkpoint",
  "required_signals": [
    "Po zebraniu informacji, przed checkpointem, Codex pokazuje po polsku w głównej merytorycznej odpowiedzi provisional roadmapę całego objective",
    "Roadmapa jest uporządkowana, wskazuje bieżący milestone oraz znaną późniejszą niepewność lub decyzję; dla prostego objective nie mnoży sztucznych etapów",
    "Checkpoint jasno oddziela zakres bieżącego milestone'u do zatwierdzenia od informacyjnej, rewizowalnej roadmapy",
    "Po zatwierdzeniu Codex wykonuje tylko bieżący milestone, weryfikuje wynik i zatrzymuje się przed kolejnym checkpointem"
  ],
  "scenarios": [
    "C-03",
    "C-04",
    "C-13",
    "C-17"
  ]
}
